created_utc,subreddit,title
1635118883,news,Supporters of unvaccinated NBA star Kyrie Irving storm past barricades outside game
1635118006,news,Body of missing 26-year-old Texas man found in Grand Teton National Park
1635116237,news,"Two SF Prosecutors Quit &amp; Join Effort to Oust Former Boss, District Attorney Chesa Boudin"
1635115094,news,"James Michael Tyler, who played Gunther in 'Friends,' dies of prostate cancer"
1635114451,news,Plane from NY to LA makes emergency landing in Wisconsin
1635114094,news,2 children dead as vehicle plows into spectators at Texas drag racing event
1635113223,news,Sri Lanka bans contaminated Chinese fertiliser
1635112848,news,Homeowner charged in slaying of motorist in his driveway
1635112300,news,"James Michael Tyler, Actor Who Played Gunther on ‘Friends,’ Dies at 59"
1635111653,news,Whistleblower says San Jose gave city contracts to ally of mayor
1635111560,news,Colombian drug lord Otoniel to be extradited to US
1635111219,news,Powerful storm hits California amid warnings of ‘potentially historic rain’
1635110571,news,"Afghanistan hurtling toward collapse, Sweden and Pakistan say"
1635108022,news,"Children are expected to be eligible for the vaccine in early November, Dr. Anthony Fauci says"
1635107188,news,Fauci predicts Covid shots for kids five to 11 will be available by early November
1635103814,news,NJ Governor Prediction | Veritas Insights. Race tightens down the stretch.
1635099367,news,Rep. Jim Banks suspended from Twitter for misgendering trans government official Dr. Rachel Levine
1635099306,news,France's Macron scores penalty in charity soccer match
1635098408,news,Kobe Bryant's wife Vanessa first heard of his death online
1635097324,news,A record amount of Americans are quitting their jobs due to pandemic burnout
1635096873,news,"Gun in Alec Baldwin Accident Was Also Used Off-Set, Recreationally"
1635094733,news,"'I want accountability': Kobe Bryant's widow reveals grief, harassment following helicopter crash"
1635093469,news,US lawyer who sued Chevron sentenced to 6 months in contempt case
1635093422,news,3.6 magnitude earthquake rattles metro Los Angeles
1635093255,news,Mexico: Thousands of migrants set off from southern city
1635092833,news,A nurse created a baby registry for a new father after his unvaccinated wife died of Covid-19 before meeting their baby
1635092697,news,Ed Sheeran tests positive for Covid-19
1635091203,news,West Bank: Israeli settlers uproot hundreds of Palestinian village's olive trees
1635089803,news,Woman injured after man drives into anti-vaccination mandate protest
1635089735,news,Woman injured after police drives into anti-vaccination mandate protest
1635089651,news,Birmingham program offering monthly payments to single moms
1635089428,news,Police: Woman killed in standoff feared harm from police
1635088800,news,antarvasna story
1635087067,news,Sheep replace cars as they cross Madrid en route to winter pastures
1635086664,news,Africa tries to end vaccine inequity by replicating its own
1635086418,news,German police stop far-right vigilante border patrols near Polish border
1635085996,news,Senate directs NASA to choose another company to build a lunar lander: report
1635084435,news,Somalis in UK targeted with death threats and abuse after David Amess killing
1635084386,news,German police halt armed far-right vigilantes on Polish border | Germany
1635084272,news,Not everyone approves of this princess' wedding. She's going ahead with it anyway
1635084115,news,"Tens of millions of filthy, used medical gloves imported into the US"
1635083757,news,"Israel set to OK 3,000 West Bank settler homes this week"
1635082458,news,NIH says grantee failed to report experiment in Wuhan that created a bat virus that made mice sicker | Science
1635080898,news,"911 operator hung up on Spanish-speaking caller in deadly Lehigh Valley fire, lawsuit alleges"
1635080669,news,Fauci’s NIH Division Partially Funded Insects Eating Beagles Alive
1635080441,news,Candlelight vigil planned in Burbank for cinematographer killed on New Mexico movie set
1635079943,news,How Puerto Rico became the most vaccinated place in America
1635079469,news,"75 years ago today (Oct 24th, 1946), a Nazi rocket took the very first photo of Earth from space"
1635078858,news,Colombia's most wanted drug lord Otoniel captured
1635078665,news,"Across Africa, major churches strongly oppose LGBTQ rights"
1635078020,news,"The Undeniable Ivermectin Miracle in India’s 240m Populated Largest State, Uttar Pradesh"
1635077869,news,Colombia&amp;#x27;s most wanted drug lord Otoniel captured
1635077657,news,"NZ police answer 4-year-old's call, confirm toys are cool"
1635077466,news,"Wright Brothers, wrong design: Ohio mangles license plate"
1635077338,news,"Peter Scolari of 'Newhart,' 'Bosom Buddies,' dies at 66"
1635074985,news,UN biodiversity talks in China end in funding pledges to reduce loss of species
1635073423,news,"Erdogan expels French ambassador along with those of 9 other countries including Germany, US"
1635071095,news,Picasso artworks in Las Vegas fetch more than $100 million
1635068971,news,Greta on Greta: 'I'm a different person in private'
1635067054,news,Braves beat Dodgers to World Series spot
1635066580,news,"Interview| Social media has become a behaviour modification system, manipulated by strongmen governments: Maria Ressa"
1635066081,news,"'Rust' assistant director had a history of unsafe practices, prop maker says"
1635065108,news,Violence over Italy's strict Covid pass has ignited a national debate about fascism
1635063439,news,"Across Africa, major churches still strongly oppose LGBTQ rights | Africanews"
1635063325,news,Ghana president calls for tolerance as parliament considers anti-LGBT+ law
1635062623,news,"Youtuber, MrBeast will remove 30 million pounds of trash from the ocean."
1635060188,news,Chemical Dye Technique – A Promising Solution For Long Term Data Storage
1635059651,news,1 in 5 US military families are food-insecure since the pandemic started
1635058354,news,A-level textbook withdrawn over 'shocking' Native American question
1635052585,news,Iranian governor slapped in the face during public speech
1635051724,news,"A man was 'covered' in poop after a passing plane dumped toilet waste over his backyard, lawmaker says"
1635046277,news,Walmart Recalls Deadly Aromatherapy Spray Made by Better Homes and Gardens
1635043265,news,Dads spend time in Louisiana high school after 23 students were arrested in string of violence
1635042124,news,COVID outbreak reported in New Hampshire's largest jail
1635041628,news,Florida Man conducts experiment with local job market claims.
1635041560,news,US Govt 'did not have the resources' to reunite children separated at border
1635041129,news,Colombian kingpin 'Otoniel' arrested in 'biggest blow to drug trafficking since fall of Pablo Escobar'
1635040072,news,Colombia's most wanted drug lord captured in jungle raid
1635039769,news,"Drag racer slams into spectators in Texas; 2 killed, 5 hurt"
1635037739,news,"Cargo carrier on fire near Victoria, crew could be forced to abandon ship"
1635036625,news,Colombia’s most wanted drug lord captured in jungle raid
1635036563,news,Italian flight attendants strip off to protest working conditions
1635036210,news,"Scammer used Zelle to steal $7,000 from SoCal couple's bank account."
1635034568,news,"Walmart recalls aromatherapy spray linked to rare bacteria, 2 deaths"
1635034385,news,'We don't negotiate with terrorists': Muslim student says he's shocked by NJ teacher's remarks
1635034294,news,Where are the workers? Cutoff of jobless aid spurs no influx
1635029761,news,Arizona may redirect some rent-relief dollars to urban areas
1635028442,news,US regulators lay out plan for over-the-counter hearing aids
1635027955,news,civilbeat.org/2021/10/police-handcuffed-and-detained-ten-year-old-student-over-offensive-drawing-lawyers-say/
1635027577,news,Retirement debt eating up state funding to Louisiana schools
1635027512,news,Elon Musk Crypto Give Away
1635023307,news,"Falklands Election: Peter Biggs, “Our allegiance with the UK is vital; I hope Argentina will mature into a democracy”"
1635023020,news,One person was killed and seven more injured at an off-campus party near Fort Valley State University
1635022678,news,"Body of missing 5-year-old likely found buried in woods, authorities say"
1635022341,news,"Two Doral police officers injured, suspect killed in shooting outside Miami-Dade police station"
1635021615,news,California travel blogger among 2 killed in Mexico's Tulum
1635020300,news,Film crew voiced complaints before fatal on-set shooting
1635019793,news,Guelph Police Say They Arrested A Machete-Wielding Clown &amp; It's Just Like A Horror Movie
1635019149,news,"Georgia man used $57K of COVID-19 relief loan to buy Pokemon card, feds say"
1635018537,news,Best MagSafe car mounts 2021
1635018183,news,Colombia is putting its 'cocaine hippos' on birth control
1635017166,news,Three-time Olympic skater Evan Bates decries “terrible” human rights issues in 2022 host China - OlympicTalk | NBC Sports
1635016980,news,A multi-day severe storm event will impact more than 50 million people from Oklahoma to New Jersey
1635016818,news,New migrant caravan in Mexico pushes past blockade to head north
1635014934,news,"It's proving difficult to find a jury in the trial for Ahmaud Arbery's killing. Potential jurors either know the case well, know the defendants or are scared"
1635014754,news,Here's How To Get Canada's Vaccine Passport &amp; Use It When You Travel
1635013928,news,"Parents, students furious over video of Nassau County kids using racial slurs, wearing white hood"
1635013366,news,Transgender council member likely first in Washington state
1635012618,news,Yulee football team shows solidarity for teammates suspended over controversial video
1635011309,news,Narco Submarine Stopped By Ecuadorian Navy Sailing Ship
1635009505,news,"Russian, Chinese warships hold first joint patrols in the Pacific"
1635008535,news,Turkey moves to throw out US and nine other envoys
1635008455,news,Ohio mocked over wrong Wright brothers number plates
1635006064,news,Newest class of Baltimore officers take oath amid changes to future of policing
1635005623,news,"2 DC Officers, Man Hurt After Officer Shot Suspect From Inside Moving Car"
1635004645,news,China passes law to cut homework pressure on students
1635003997,news,Texas fly fisherman catches potential world-record blue catfish
1635003685,news,Ky. nurses seek money to boost profession amid shortage
1635003561,news,"'Dangerous to hunt illegally': Elephant kills poacher in South Africa, park officials suspect"
1635003476,news,"Turkey to banish 10 Western ambassadors, Erdogan says"
1635003298,news,It's giveaway time!
1635003255,news,Suspected poacher likely killed by elephant in South Africa
1635001748,news,Jared Kushner in talks with Saudi Arabia to receive $2bn for investment firm: Report
1635000633,news,Record high migrant detentions at US-Mexico border
1634999394,news,"Odisha teen sold wife to Rajasthan man month after wedding, bought a smartphone"
1634999130,news,Body scan reveals shotgun shell inside Alabama prisoner
1634996725,news,China passes law to cut homework and tutoring 'pressures' on children
1634996578,news,Mystery of exotic infectious disease traced to aromatherapy room spray
1634995105,news,Iran provincial governor slapped in a rare security breach
1634995059,news,"Healthcare Workers, Teachers Protest Mandatory COVID Vaccination as Restrictions Ease in Australia"
1634993233,news,"Saudi Arabia targets net zero emissions by 2060, crown prince says"
1634992544,news,"Afghanistan heading towards collapse faster than expected, Swedish minister warns"
1634990250,news,"White House delays release of JFK assassination files ""to protect against identifiable harm"""
1634988338,news,Qatar opens Al Thumama Stadium in preparation for the 2021 World Cup
1634987885,news,FDA says benefits outweigh risks for Pfizer/BioNTech COVID-19 vaccine in children
1634987712,news,A California teacher was placed on leave after video shows her mimicking Native American dance
1634987565,news,Ecquador grapples with a spiral of violence
1634986263,news,"Vin Diesel walks Paul Walker’s daughter down the aisle as she gets married, fans say ‘Paul would’ve been happy’"
1634984762,news,Outcry as Israel labels Palestinian rights groups ‘terrorists’ | Human Rights News
1634983082,news,Prison workers top list of those not complying with mandate
1634977756,news,US kills senior al-Qaeda leader in Syria with drone strike
1634970135,news,Sweden’s royals follow Dutch and confirm same sex marriage is no bar to the throne
1634970052,news,King Harald attends ceremony for handover of important Sami document
1634968259,news,Sri Lankan police brutalise Tamil youth in Batticaloa
1634965863,news,Drone footage shows La Palma volcano continuing to erupt
1634963223,news,Soekarno’s Daughter Converts to Hinduism
1634955806,news,DNA match IDs Alaska serial killer’s victim after 37 years
1634954147,news,Third of pacific island unable to attend COP26
1634953551,news,Facebook whistleblower releases documents to multiple news outlets showing company knows the harm it causes
1634953428,news,Third juror dismissed in Elizabeth Holmes trial after found playing Sudoku
1634952270,news,Not stopping 'Stop the Steal:' Facebook Papers paint damning picture of company's role in insurrection
1634951666,news,U.S. takes step toward oil and gas auction off Alaska coast next year
1634949363,news,Dirt bike rider struck and killed by fire truck in West Baltimore
1634949137,news,US says it killed al-Qaeda leader in Syria with drone strike
1634948857,news,How AARP Puts Profits over Patients—And Principles – InsideSources
1634948338,news,New Brunswick pastor apologizes after week in jail over COVID-19 rule breaches
1634947106,news,Justice Department to expand redlining investigation efforts
1634947039,news,Luxembourg first in Europe to legalise growing and using cannabis
1634946914,news,Guns—Even Props—Are Not Toys
1634946396,news,Warrant: Baldwin didn't know weapon contained live round
1634945442,news,US nearing a formal agreement to use Pakistan's airspace to carry out military operations in Afghanistan
1634942650,news,‘Carol’s Journey’: What Facebook knew about how it radicalized users
1634942580,news,Search underway for Texas man missing in Grand Teton National Park
1634942477,news,"NIH letter appears to conflict with Fauci, Collins claims about Wuhan lab"
1634941976,news,"Giant 4,000 pound sunfish was rescued from a fishing net off the Spanish coast of Ceuta"
1634941178,news,Search Crews Are Looking for a Missing Texas Man in Grand Teton National Park
1634941108,news,U.S. reports record number of migrant apprehensions along Mexican border
1634940007,news,Lyft report: Sexual assaults rose sharply in recent years
1634939816,news,Minneapolis officer charged in pursuit that killed motorist
1634938972,news,"Five UK police officers shared violent sexual images in relation to Sarah Everard's murder, police watchdog says"
1634938343,news,Man arrested in connection with 2017 Manchester Arena bombing
1634938202,news,Judge issues injunction blocking Wisconsin fall wolf hunt
1634936346,news,Pfizer says COVID-19 vaccine more than 90% effective in kids
1634935991,news,Adobe will put U.S. employees on unpaid leave if they’re not vaccinated by Dec. 8
1634935189,news,Workers pushing to unionize Amazon say they faced retaliation and unfair tactics
1634934934,news,دانلود آهنگ کردی گیس چنریا از ساسان ملکی
1634932241,news,Afghan teen facing rape charge in Missoula is part of resettlement program
1634931331,news,Apple's M1 Max chipset shows its teeth in PugetBench for Premiere Pro
1634930901,news,Former Rudy Giuliani associate Lev Parnas convicted in campaign finance case
1634929894,news,Oklahoma woman convicted of manslaughter for suffering miscarriage
1634929809,news,Attorney Tana Lin is now the first Asian American U.S. judge in Washington state
1634927120,news,"Teen charged with murder after pouring gas on couple, setting them on fire, police say"
1634927068,news,"Walmart, Walgreens U.S. stores roll out Moderna, J&amp;J COVID-19 booster shots"
1634925970,news,U.S. officials keep close watch on the 'delta plus' Covid mutation as it spreads in the U.K.
1634925842,news,Man charged with murder for fatal shooting outside home in Caldwell Co.
1634925469,news,Exclusive: Adil Dghoughi’s Murderer Arrested 11 Days After Murder
1634925366,news,Bourbon maker reaches tentative deal with striking workers
1634925255,news,Israel declares six Palestinian civil society groups 'terrorist organisations'
1634925184,news,'Simply not true': Prosecutor disputes reports commuters 'callously' recorded rape on SEPTA train
1634923173,news,People Who Get Fired For Being Unvaccinated In Canada Likely Won't Be Able To Get EI
1634922926,news,"Supreme Court leaves Texas abortion ban in place, agrees to take up legal battle over law"
1634921701,news,"No Proof Anyone ‘Callously' Took Video of Rape on SEPTA Train, DA Says"
1634921422,news,Administration makes final pitch to block Texas abortion law
1634921053,news,Deputies: Man fatally shoots neighbor in dispute over a cat
1634920810,news,‘Reports’: Union claims live round was in prop gun
1634920798,news,Prominent Bitcoin Core Developer Jonas Schnelli Quits
1634920641,news,The Supreme Court will hear a new challenge to Texas' restrictive abortion law
1634919012,news,"Big-Shot Lawyers Don't Understand Steven Donziger's ""Eat Me"" Strategy"
1634918988,news,Alec Baldwin says his 'heart is broken' over deadly movie set shooting in his first comments
1634918873,news,Business group warns of mass layoffs and 'catastrophic' supply chain disruptions from Biden's vaccine mandate
1634918831,news,"Alec Baldwin Fatally Shoots Crew Member With Prop Firearm, Authorities Say"
1634918762,news,"AP: US budget deficit hits $2.77 trillion in 2021, 2nd highest"
1634918631,news,EU leaders seek to halt migrant crossings from Belarus
1634917912,news,Students sue Texas school district for banning long hair on boys
1634916461,news,"US budget deficit hits $2.77 trillion in 2021, 2nd highest"
1634916302,news,"US budget deficit hits $2.77 trillion in 2021, 2nd highest on record"
1634914761,news,Robert Durst charged with murder of former wife
1634914706,news,Official: Narrative of riders filming train rape is false
1634914208,news,Elevated lead levels found in Hamtramck Michigan water; distribution of filters happening Thursday
1634914106,news,Parents petition school district after photos appear to show spoiled lunches
1634913813,news,Rightwing pundit Candace Owens suggests US invade Australia to ‘free an oppressed people’
1634913748,news,The city of Hamtramck is latest Michigan area giving filters to residents as a result of high lead results in some drinking water samples
1634913542,news,Teen Lamborghini driver sentenced in West LA crash that killed Monique Muñoz
1634913336,news,"Riders who did not intervene during alleged sexual assault on a SEPTA train won't face charges, prosecutor says"
1634913217,news,COVID-19 cases rising 2-3 times faster on Native American reservations in Minnesota compared to general state population
1634913030,news,Fights over confidentiality pledge and conflicts of interest tore apart COVID-19 origin probe
1634912555,news,Texas Lt. Gov. Dan Patrick's First Voter Fraud Bounty Goes to a PA Democrat
1634911917,news,Robert Durst charged with 1982 murder of wife Kathie Durst
1634911709,news,India Most Pro-Vaccine Country In The World
1634911301,news,Haiti gang leader threatens to kill kidnapped American missionaries if $17M ransom demand is not paid
1634911044,news,Huge blast kills 16 at Russian gunpowder and chemicals plant
1634910056,news,Australia asks why Hong Kong considers lobsters national security risk
1634909272,news,This meat is soon disappearing from Chipotle's menu
1634909063,news,American Must Protect 5 Crucial Technologies To Remain a Superpower
1634908415,news,Ethiopian airstrikes in Tigray force UN flight to turn back
1634907967,news,"Swedish rapper Einar shot dead at 19, stoking outrage over gang violence"
1634906933,news,Pfizer says Covid vaccine more than 90 percent effective in kids
1634905200,news,Attorneys Admit Making Explosives Thrown at NYPD Vehicle in NYC Floyd Protests
1634904792,news,‘The plan is to drink all day’: sunny Melbourne celebrates its freedom day.
1634904393,news,"Barbados elects first president, replacing UK Queen as head of state"
1634902815,news,Ethiopian government strikes Tigray capital for fourth day this week
1634902774,news,Queen Elizabeth spent the night in a hospital for 'preliminary investigations'
1634902549,news,"Baldwin fired prop gun on movie set, killing woman"
1634902182,news,16 killed in Russian gunpowder factory blast
1634901408,news,"DOJ adds 2 top prosecutors to Matt Gaetz investigation, sources say"
1634900446,news,Northern states see uptick in COVID-19 infections and hospitalizations as weather gets colder
1634900181,news,2 dead after a former employee opens fire at a Nebraska grain services facility
1634900075,news,"In corporate crackdown, U.S. SEC takes aim at executive pay"
1634898098,news,"Illegal, untested CBD products are everywhere and could be putting you at risk"
1634896156,news,Thousands of refugees and migrants plead for Libya evacuation
1634893610,news,Hundreds In US Fall Sick In Raw Onion-Linked Salmonella Outbreak
1634891680,news,Gang boss in Haiti threatens to kill abducted missionaries
1634890661,news,'I had no idea': Mom finally meets officer who has been keeping her daughter's memorial clean for years
1634889882,news,"Fire On 19th Floor Of Luxury Residential Tower In Mumbai, 1 Dead"
1634888756,news,Gabby Petito's fiancé was found dead
1634887429,news,Oregon foster child mistreated while out of state joins federal lawmakers in oversight push
1634883662,news,"Bitcoin surges to new record above $66,000"
1634882582,news,The 'Delta Plus' AY.4.2 Coronavirus Variant Is Rising in the U.K.
1634878969,news,India crosses 1 Billion jabs against COVID
1634878742,news,Crime-hit Chicago grapples with police vaccine revolt
1634877801,news,NIH admits US funded gain-of-function in Wuhan — despite Fauci’s denials
1634876618,news,New Photos Show Horrific Overcrowding at Rikers Island
1634875757,news,"Royal Poetical Starz, a 26-year-old Black transgender woman who was fatally shot in Miami Gardens, Florida on October 2, 2021. Starz’s death is at least the 40th violent killing of a transgender or gender non-conforming person in 2021."
1634875439,news,"Alec Baldwin's prop firearm discharges on ""Rust"" movie set, killing photographer and injuring director"
1634874330,news,Sherrif: Baldwin fired shot on movie set that killed woman
1634874221,news,"Alec Baldwin fired prop gun, killing DP"
1634873956,news,'Rust' crew member dead after shooting incident involving Alec Baldwin
1634873826,news,Alec Baldwin allegedly shoots and kills director of photography on set of his latest film
1634873502,news,Email from Loudoun Co. superintendent alerted school board on day of bathroom assault
1634873361,news,"Alec Baldwin fires prop gun on set of movie, killing a crew member and injuring director"
1634873335,news,India crosses 1 billion 1st dose covid vaccination mark
1634872748,news,"Alec Baldwin Discharged Prop Firearm Resulting in Cinematographer's Death, Director's Injury on New Movie Set"
1634871926,news,Alex Baldwin mistakenly fired fatal shot that killed director of photography on his set for the movie Rust
1634871840,news,"Alec Baldwin shoots prop gun, killing 1, injuring another on set of 'Rust,' New Mexico officials say"
1634871058,news,"Alec Baldwin shoots prop gun, killing 1, injuring another on set of ‘Rust,’ New Mexico officials say"
1634870863,news,Woman shot to death on set of new Alec Baldwin movie Rust
1634870196,news,Texas Lt Governor pays out voter fraud bounty for convicted republican voter
1634870068,news,"Alec Baldwin accidentally discharged prop gun loaded with live rounds, killing cinematographer and injuring director on new movie “Rust”"
1634869748,news,"1 dead, 1 hospitalized after prop gun misfires on set of Alec Baldwin film in Santa Fe"
1634868773,news,Amy Ferris Joins Varo Bank as Chief Growth Officer
1634866400,news,US Fed bans officials from buying stocks after ethics scandal
1634865828,news,This photojournalist faked an entire book to highlight how hard it is to spot misinformation
1634864855,news,Inmate transport driver sentenced to life for sex assaults
1634864377,news,Woman killed on set of Alec Baldwin film 'Rust' after prop gun incident
1634862260,news,Syria executes 24 people for starting forest fires that destroyed ancestral home of leader Bashar al-Assad
1634861809,news,California proposes new oil drilling ban near neighborhoods
1634861694,news,2 crew members hospitalized after prop gun misfires on set of Alec Baldwin film
1634859775,news,Human remains at Florida park confirmed to be boyfriend of Gabby Petito.
1634858651,news,"Police: Fired grain elevator worker shot 3 people, killing 1"
1634858360,news,Report: Far-right anti-government group grows significantly
1634858109,news,Enes Kanter: Boston Celtics star under fire over China comments
1634857501,news,Riverside teacher placed on leave after mimicking Native Americans during math class
1634856629,news,Robot artist Ai-Da released by Egyptian border guards
1634856325,news,Museum proposes melting Lee statue to make new artwork
1634856292,news,Netflix employees stage walkout over Dave Chappelle special
1634855891,news,D.C. assistant police chief says she was told to 'have an abortion or be fired'
1634855214,news,Canada launches proof of vaccination credential for international travel
1634855147,news,"Queen Elizabeth spent the night in hospital, Buckingham Palace says"
