created_utc,subreddit,title
1634686809,news,US: Couple accused in submarine espionage case indicted
1634686368,news,A fully solar-powered campervan has just driven through Europe
1634686182,news,SAN FRANCISCO CLOSES IN-N-OUT BURGER AFTER DEFYING CITY’S VACCINE RULE
1634685269,news,"Train riders held up phones as woman was raped, Philadelphia police say"
1634685004,news,Credit Suisse fined over Mozambique tuna scandal
1634683151,news,Leaked Covid-19 report calls for mass homicide charges against Brazilian President Jair Bolsonaro
1634681854,news,Parents and teachers voice concern at Texas school board meeting after Holocaust remark
1634681835,news,N.Korea says it conducted successful missile test from submarine
1634681672,news,"It's not Kanye, it's Ye, after judge approves name change"
1634681158,news,Brazilian panel accuses Bolsonaro of homicide over handling of pandemic: report
1634681117,news,Marijuana in the workplace: NY employers can't drug test most employees for weed
1634681072,news,US high court won’t block vaccines for Maine health workers
1634679463,news,Authorities arrest Alabama man in Alaska after Jan. 6 riot
1634675412,news,The UAE has climbed 10 places to be ranked fourth as the world's top destination for living and working according to the results of the fourteenth edition of HSBC Expat Explorer Annual Report.
1634675402,news,"Bystanders on Philadelphia train held up phones as woman was raped, police say"
1634674125,news,More than 20 people safely escape after plane crashes outside Houston
1634673954,news,"Bolsonaro should face murder charges over Brazil’s Covid disaster, draft senate report says"
1634673490,news,"Mel Brooks Making A Sequel To One Of His Greatest Movies, At Last"
1634673452,news,"Oklahoma's anti-critical race theory law violates free speech rights, ACLU suit says"
1634673117,news,Salmonella outbreak with unknown food source infects nearly 600 people nationwide
1634673082,news,Orion: Nasa's Moon ship ready to be attached to rocket
1634672540,news,"Man charged in Jan. 6 riot stole Capitol officer's hat, wore it on YouTube, officials say"
1634671465,news,Russia is pouring millions into Kremlin propaganda targeting the U.S.
1634671332,news,Former Nygard building goes up in flames; sustains major damage
1634670301,news,Missing New Hampshire woman and vanished boyfriend's case eerily similar to Gabby Petito
1634669769,news,Southwest drops plan to put unvaccinated staff on unpaid leave starting in December
1634669605,news,Global Glycerol Ester of Hydrogenated Rosin Market Growth 2021-2026 : ReportsnReports
1634669595,news,"Without Covid-19 jab, ‘reinfection may occur every 16 months’"
1634669135,news,Florida’s COVID-19 new cases and positivity rate keep going down
1634668612,news,U.S. workers face layoffs as U.S COVID-19 vaccine mandates kick in
1634668495,news,FBI agents search home of Russian billionaire and Putin associate Oleg Deripaska
1634668355,news,Global Bridge Design and Construction Market Growth (Status and Outlook) 2021-2026 : ReportsnReports
1634668214,news,Chicago Begins Placing Officers on Leave for Unreported Vaccination Status
1634668021,news,Ethiopian Leader Says Tigray Blockade Deliberate
1634667253,news,"21 passengers escape plane safely after crash in Texas, officials say - National | Globalnews.ca"
1634667011,news,Hamas warns Israel another war is inevitable unless it ends occupation of Palestine | World News
1634666644,news,'Click To Pray' 2.0 at the service of the synodal process - Vatican News
1634666445,news,Donald Trump (yet again) proves there’s no bottom
1634666427,news,"Philadelphia case: Train riders held up phones as woman was raped, police say"
1634666238,news,University of Kentucky student found unresponsive at fraternity dies
1634666193,news,Why the world is facing a global energy crunch
1634665214,news,Baltimore’s No-Prosecution Policy for Low-Level Drug Possession and Prostitution Finds Almost No Rearrests for Serious Offenses | Johns Hopkins Bloomberg School of Public Health
1634664558,news,Australia's 'biggest-ever' hailstones damage cars and shatter windows in Queensland | World News
1634663535,news,"Plane with 21 people onboard crashes in field near Houston Executive Airport; At least 1 person injured, authorities say"
1634663291,news,Johnson &amp; Johnson Sending Talc Cases to Bankruptcy Court
1634662939,news,Facebook paying fine to settle US suit on discrimination
1634662461,news,"Massachusetts: Police: 23-year-old Amazon driver accused of recording women, girls in Wrentham Outlets bathroom"
1634661996,news,NYPD officers face discipline due to alleged Black Lives Matter protest misconduct
1634661764,news,"Plane crash Katy, Texas: Aircraft down in field near Houston Executive Airport; 21 people on board - Reports are they all got out safely"
1634661479,news,"Train riders held up cellphones as woman was raped on SEPTA, police say"
1634659345,news,GlobalFoundries seeks $25 bln valuation in U.S. IPO as chip demand soars
1634659240,news,La Palma evacuees see no end to ordeal after month of volcanic eruption
1634658861,news,North America's biggest container port faces record backlog
1634658443,news,FBI at home of Russian oligarch and ex-Manafort associate Oleg Deripaska
1634657764,news,"Metro 7000-Series Safety Problems Could Have Led To ‘Catastrophic Event,’ Service Limited This Week - Metro says reduced train service will continue at least throughout the week as its newest 7000-series trains remained sidelined because of safety issues."
1634657249,news,Politician Yodommah Ibn Ayyubi died today in a terrorist attack in teheran
1634657128,news,Mother detained in China after petition for Chinese authorities to explain death of vaccinated 12 year old daughter
1634657094,news,Why so many teachers are thinking of quitting
1634657087,news,Netherlands on track to phase out coal power by 2030
1634656808,news,The shortages hitting countries around the world. Explained
1634654817,news,Click to Pray 2.0 - Vatican app gets up close and personal with God
1634654633,news,Male State: Russia bans group for anti-women and anti-gay posts
1634654329,news,Polish PM accuses EU of blackmail as row over rule of law escalates
1634653706,news,"BAMN announces plans to file lawsuit against Whitmer, Detroit public schools over vaccination mandate"
1634652716,news,Price Naloxone (Narcan) Soars Amid Record Deaths
1634651999,news,"Former teacher, coach gets probation in child porn case"
1634651498,news,Haiti gang demands $17M ransom for kidnapped American and Canadian missionaries
1634651489,news,Price for drug that reverses opioid overdoses soars amid record deaths | Opioids crisis
1634651020,news,"Train riders held up phones as woman was raped, Philadelphia police say."
1634650831,news,"Google deletes 3,000+ articles over bogus DMCA notice"
1634649085,news,Tigray: Ethiopian government admits Mekelle airstrike
1634648591,news,"Capital of Ethiopia's Tigray hit by airstrikes, eyewitness and local forces say"
1634648088,news,Lawyer who represented George Zimmerman arrested in Florida
1634647357,news,Poland nearly doubles troop numbers on Belarus border
1634647137,news,Russia chooses not to raise natural gas supplies to Europe despite Putin's pledge to help
1634646480,news,Australian state could fire more than 40 police staff for refusing a Covid-19 vaccine
1634644604,news,'Water's Soul': Massive white sculpture makes a statement in New York harbor
1634644011,news,Covid-19: New mutation of Delta variant under close watch in UK
1634643859,news,Washington State University fires head football coach for refusing Covid-19 vaccine
1634642406,news,"New Zealand's Covid-19 cases touch all-time high, govt pushes for vaccination"
1634642093,news,"Bill Gates was warned to stop sending flirtatious emails to female colleague in 2008, Microsoft reveals"
1634640283,news,Miami private school makes bogus claims about vaccines while ordering pupils who get a shot to stay home for 30 days
1634639980,news,"Survivors of 1980s poisoning occupy Spain's El Prado, threaten suicide"
1634639767,news,UK under pressure to reimpose restrictions as COVID cases soar
1634639017,news,"Haiti gang wants $17M ransom for kidnapped American and Canadian missionaries, say reports"
1634633329,news,"Robotexts are flooding our phones, and the FCC is looking at ways to stop them"
1634632478,news,"'A dangerous time': Portland, Oregon, sees record homicides"
1634630988,news,North Korea fires submarine-launched ballistic missile into waters off Japan
1634630775,news,University of North Carolina defeats challenge to race-based admissions policies
1634626919,news,Israeli scuba diver discovers ancient Crusader sword
1634625577,news,"Kidnapping in Haiti shines spotlight on gangs, risk experts say"
1634625099,news,US and China urged to find way to work together before Cop26 | Cop26
1634624893,news,PM urged to enact ‘David’s law’ against social media abuse after Amess’s death
1634624555,news,"Small minority of U.S. Olympians oppose COVID-19 vaccine mandate, say officials"
1634624386,news,Narendra Modi: 'Why is the Indian PM' photo on my Covid vaccine certificate?'
1634619643,news,"China, Russia navy ships jointly sail through Japan strait"
1634618862,news,Britain reports highest number of COVID-19 cases since mid-July
1634616465,news,Federal judge rejects bid to block Oregon vaccine mandate
1634614676,news,"Train Riders Held Up Phones as Woman Was Raped, Police Say"
1634614554,news,Woman sexually assaulted on train as bystanders did nothing
1634612961,news,Taxing Cash Apps
1634612774,news,Amazon's Jeff Bezos 'may have lied to Congress'
1634612680,news,Tight U.S. job market triggers strikes for more pay
1634611852,news,"US envoy to Afghanistan resigns in wake of chaotic withdrawal ,"
1634611403,news,"100,000 workers take action as 'Striketober' hits the US"
1634611195,news,DC suspends most of its Metro trains over safety issue
1634610322,news,North korea fired a missle of it east coast Tuesday
1634610136,news,U.S. envoy to Afghanistan Zalmay Khalilzad resigns
1634609567,news,Microchip shortage: Why US is poised to take rare action
1634608805,news,North korea might have fired a missile off its east coast
1634608695,news,North korea may have fired a missile
1634608262,news,"So far, COVID-19 spikes from college football games haven’t materialized"
1634606596,news,New Mexico clears way for hospitals to ration care if needed
1634606402,news,"Amazon plans to hire 150,000 temporary workers for the holidays"
1634604988,news,"California now only state to improve to 'moderate' level of COVID transmission, CDC says (Pandemic? What pandemic?)"
1634604570,news,WSU head football coach Nick Rolovich fired after refusing to get COVID-19 vaccine
1634604137,news,"6 people, including 1 American, slain at ranch in Costa Rica"
1634603869,news,65 NYC Cops Face Departmental Misconduct Charges in George Floyd Protests
1634603445,news,94 unvaccinated staff at Yale New Haven Health lose their jobs
1634603329,news,NHL player Evander Kane suspended following league's investigation into his Covid-19 vaccine card
1634603243,news,Washington State fires Nick Rolovich as vaccine mandate deadline passes: Sources
1634603142,news,"Family of Elijah McClain reaches settlement with Aurora, Colorado"
1634602961,news,"UK Covid cases near 50,000 in one day as No 10 warns of ‘challenging’ winter | Coronavirus"
1634602825,news,Reports: Nick Rolovich fired as Washington State football coach after failing to comply with state vaccine mandate
1634601825,news,Zillow slams the brakes on home buying as it struggles to manage its backlog of inventory
1634601085,news,WSU coach Nick Rolovich has been fired for not complying with vaccine mandate
1634600384,news,Kanye West has legally changed his name to Ye
1634600150,news,Alaska pediatricians criticize Anchorage’s chief medical officer over ‘grossly misleading’ comments on COVID
1634599177,news,Jury selection begins in trial of 3 men accused in Ahmaud Arbery's killing
1634598351,news,Explained: the links between Bill Gates and Jeffrey Epstein
1634597985,news,"1 dead, 2 injured in separate falls at Phish concert in San Francisco"
1634597976,news,Three dead after jamaican police raid cult compound on suspicion of ritualized killings
1634597084,news,JPSO Deputy Under Investigation After Video Shows Him Slamming Black Woman's Head on Pavement
1634596900,news,"Mel Brooks plans sequel to ‘History of the World, Part 1’"
1634596748,news,"Two Hindu men killed, temples vandalised in Bangladesh violence"
1634596675,news,Amazon down for more then 48 hours for millions of customers
1634595858,news,Thomas Jefferson statue to be removed from New York City Hall
1634595700,news,Dutch royals can marry same-sex partner without giving up crown
1634595342,news,Why Ketamine-Assisted Therapy Has Gone Mainstream
1634594948,news,DC Police Shot And Killed A Man Inside Home On Capitol St. SE
1634594933,news,The NHL has suspended San Jose Sharks forward Evander Kane for 21 games for submitting a fake COVID-19 vaccination card.
1634594640,news,Three people dead after Jamican police raid a cult
1634594337,news,Vestas’ 15-MW turbine picked for 2.1-GW Empire Wind projects offshore New York
1634594234,news,"Coast Guard believes 1,200-foot ship dragged California oil pipeline"
1634592917,news,Supreme Court will consider fast track appeal of Texas abortion law
1634591881,news,Woman denied organ transplant over refusal to get COVID-19 vaccine
1634591557,news,Bill Gates reportedly advised to end inappropriate emails with female employee in 2008
1634591055,news,Kanye West Legally Changes Name to “Ye”
1634590904,news,Innocent Appalachian Trail hiker was handcuffed at gunpoint by cops who thought he was Brian Laundrie: Forced to shave beard to prove he is not the man wanted over Gabby Petito murder
1634589973,news,US formally removes Colorado River fish's endangered status
1634589309,news,Sinclair Broadcast Group hit with ransomware
1634588656,news,China considers law to punish parents of children who 'misbehave'
1634587585,news,Fatal Shooting of Unarmed Moroccan Man in Texas Sparks Uproar
1634587275,news,2 Georgia men arrested for setting off blast in dispute
1634587158,news,"Alabama woman found dead 12 days after going inside police van, authorities say"
1634585948,news,Trump questioned under oath in lawsuit over alleged Trump Tower assault
1634585936,news,Guest editorial: Playing politics with debt limit is dangerous
1634584108,news,This site is an important piece of Filipino American history. Climate change is destroying it.
1634583911,news,Woman raped on train while passengers failed to intervene
1634583828,news,UK government ordered to reveal firms awarded ‘VIP’ Covid contracts
1634583107,news,"X-Ray Detectors Market by Technology (Flat Panel, CCD, CR Detector), Application (Medical, Orthopedic, Industrial, Veterinary, Security), FPD (Type (Gadox, CSL, Direct), Portability (Fix, Portable), Platform (Digital, Retrofit)) - Global Forecast to 2026 : ReportsnReports"
1634582895,news,"Healthcare Fraud Analytics Market by Solution Type (Descriptive, Predictive, Prescriptive), Application (Insurance Claim, Payment Integrity), Delivery (On-premise, Cloud), End User (Government, Employers, Payers), COVID-19 Impac - Global Forecast to 2026 : ReportsnReports"
1634582631,news,EU plays down chance of any Iran talks outside Vienna
1634582359,news,Turnout in Iraq's election reached 43% -electoral commission
1634581246,news,"Qualified immunity: Supreme Court sides with police, overturns denial of immunity in two cases"
1634580643,news,Japanese Princess Mako attends last rite as imperial family member
1634579616,news,The shortages hitting countries around the world
1634579332,news,Candian and U.S citizens kidnapped in Haiti.
1634579315,news,EPA to regulate certain types of 'forever chemicals' in drinking water in 2023
1634579270,news,Haiti!
1634579181,news,The Great Resignation may lead companies to offer employees financial wellness benefits
1634578897,news,"Tigray forces say air strikes hit Ethiopia's Mekelle, government denies"
1634578710,news,"Russia suspends its mission at NATO, shuts alliance's office"
1634576580,news,"Man arrested for raping a woman on a SEPTA train while other riders failed to intervene, authorities say"
1634576339,news,French ambassador ordered out of Belarus - AFP
1634575519,news,"Colorado steel mill is now largely powered by solar, among the first in the world"
1634574129,news,Supreme Court sides with police officers seeking ‘qualified immunity’ in two use-of-force cases
1634572687,news,"7-Foot-Tall Harambe Statue Stares Down Wall Street's Charging Bull, Which Is Now Covered in Bananas"
1634572075,news,‘It’s not as carbon-hungry’: UK’s largest sunlit vertical farm begins harvest
1634571400,news,Supply chain chaos is hitting global growth and it's about to get worse
1634571225,news,Artist stages mass nude photos to highlight disappearing Dead Sea
1634571186,news,"17 missionaries kidnapped by gang in Haiti, police say"
1634570630,news,Chicago Police Department says officers who don't adhere to vaccination policy could be fired
1634570151,news,"Settler attacks wreak havoc on Palestinians during olive harvest | Palestinians during olive harvest Israeli settlers are committing violent, daily attacks against Palestinians harvesting their olive trees for the season."
1634569347,news,"Facebook plans to hire 10,000 in Europe to build 'metaverse'"
1634568199,news,"'Please get vaccinated.' Daughter's death after giving birth a cautionary tale, mom says"
1634567995,news,Philippine forces kill 4 suspected Chinese drug dealers
1634566308,news,The wealthiest 10% of Americans own a record 89% of all U.S. stocks
1634565920,news,Freed murderer charged in slaying of woman who was stabbed 4 times with a screwdriver
1634565796,news,ESPN reporter Allison Williams leaving network over Covid vaccine mandate
1634565313,news,"Eric Smith, 41, granted parole after killing 4-year-old when he was 13"
1634564932,news,What are carbon offsets and do they work?
1634564896,news,Ransomware attack hits owner of dozens of local news stations
1634564188,news,Air raids hit capital of Ethiopia’s Tigray
1634564184,news,"Microsoft shutting down LinkedIn in China, the last US social media platform in the country"
1634562213,news,Home Office criticised over handling of Sri Lankan scientist’s asylum claim
1634562152,news,"Colin L. Powell, former secretary of state and military leader, dies at 84"
1634562048,news,Gen. Colin Powell Has Died
1634561870,news,Colin Powell Dies at 84
1634561666,news,"Colin Powell has died of COVID-19 complications, family says"
1634561590,news,Ex-US Secretary of State Colin Powell dies aged 84 - BBC News
1634561295,news,What caused Collin Powells death?
1634560435,news,Sinclair Broadcast Group identifies data breach
1634560406,news,Man jailed for kidnapping boy who was said to have made money from bitcoin
1634560291,news,I get abuse and threats online - why can't it be stopped?
1634559647,news,EU has exported 1 billion COVID vaccines
1634559334,news,"Colin Powell, former secretary of State who made case for Iraq invasion, dies of Covid complications at 84"
1634559246,news,Amazon is being accused of lying to Congress by 5 U.S lawmakers
1634559204,news,Colin Powell dies of Covid complications
1634559114,news,"Colin Powell, former secretary of state, dies"
1634559094,news,"Colin Powell: Former US Secretary of State dies following COVID complications, says family"
1634558494,news,More than 20 dead after heavy rains in India
1634558020,news,Woman raped on Philadelphia train with passengers watching
1634557842,news,"Sexual abuse and ‘cruel indifference’: the disgrace of the French Catholic Church: Landmark report estimates around 330,000 children were abused by clergymen and officials between 1950 and 2020"
1634555384,news,A man is on the run after allegedly killing two neighbors. Some in China hope he will never be caught
1634555045,news,Pedro Sánchez: Spanish PM vows to outlaw prostitution
1634553921,news,"Facebook plans to hire 10,000 in EU to build 'metaverse'"
1634553868,news,Activists unfurl Tibet flag at Beijing Olympics flame ceremony
1634552715,news,"Police say bystanders ""should've intervened"" as woman was raped on Philadelphia train"
1634551774,news,Ngân hàng Thượng Hải | Bank of Shanghai - BOSC
1634550892,news,"Myanmar to free over 5,000 political prisoners"
1634549521,news,"Father suspected of killing daughters, grandchildren in Pakistan marriage feud - police"
1634546617,news,Singapore: Man jailed for raping young daughter after seeking advice from ‘feng shui master’
1634545174,news,New Zealand extends Auckland lockdown in battle on Delta variant
1634539738,news,Jury selection to start in trial over Ahmaud Arbery's death
1634534919,news,Cop26 corporate sponsors condemn climate summit as ‘mismanaged’
1634533408,news,China's economic growth slows to 4.9% in the third quarter
1634533332,news,Clubs face bouncer shortage as UK staffing squeeze hits nightlife
1634531136,news,CAUGHT ON VIDEO: Gunfire rings out during GSU homecoming
1634529183,news,Springfield man accused of killing neighbor found guilty of first-degree murder
1634523765,news,NASA investigating issue with Lucy solar array
1634523615,news,"Facebook plans to hire 10,000 people in the EU to build its vision for a 'metaverse'"
1634523486,news,"China GDP disappoints, third-quarter growth slows to 4.9%"
1634521158,news,Brooklyn woman arrested in connection with suspected arson at a Jewish school
1634520973,news,"Riders watched as a woman was r***d on a SEPTA train but no one called 911, police say."
1634520463,news,"‘No One Did Anything’: Woman Raped on SEPTA Train and Riders Didn’t Call 9-1-1, Police Say"
1634520283,news,"Chicago Police Department restricts time off for officers after vaccine mandate deadline, CNN affiliate reports"
1634519626,news,Kishida sends ritual offering to war-linked Yasukuni Shrine as Suga visits
1634519556,news,"Betty Lynn, who played Thelma Lou on 'The Andy Griffith Show,' dies at 95"
1634519530,news,FBI seeks information on New Zealand man who allegedly coerced women into making sexually explicit videos
1634519371,news,"Muslims, Hindus protest amid communal violence in Bangladesh"
1634516136,news,A Florida school says students who get vaxxed must stay home for 30 days due to unfounded claim that they'll infect others
1634515553,news,Turbans used to rescue hiker above waterfall in Golden Ears park
1634514947,news,41 year old man who killed 4-year-old at age 13 (he has intermittent explosive disorder) granted parole. Good Luck out there NY
1634514158,news,Alabama library system joins 1000 Books Before Kindergarten
1634513752,news,Lauded Spanish female crime writer revealed to be three men
1634513726,news,Sydney eases more COVID-19 restrictions as vaccinations pass key milestone
1634512562,news,Sydney eases COVID restrictions
1634512346,news,Amazon asks Ring owners to respect privacy after court rules usage broke law
1634512267,news,Covid: Thousands of children left without parents in Iran
1634512243,news,"Police face questions after a woman's body is found in a police van in Huntsville, Alabama"
1634511245,news,"Three dead, including suspect, after man cuts Arkansas officer’s throat"
1634510893,news,Denuvo And Other DRM Might Have Issues On Intel's New CPUs Due To Hybrid Architecture
1634510861,news,Delta CEO REFUSES to impose Biden's vaccine mandate: Reveals 90% of staff are already jabbed
1634510567,news,China tests nuclear capable missile.
1634504510,news,House of Representatives staffer faces child porn charges
1634503139,news,Kenosha police accused of ‘deputizing’ militia vigilantes during Jacob Blake protests
1634502857,news,"Coast Guard: 1,200-foot ship dragged California oil pipeline"
1634502636,news,"Commonwealth, justice employees in Victoria granted vaccine exemption"
1634502477,news,Judge limits unpaid leave for unvaccinated workers at US lab
1634502461,news,"Now 41, man who killed 4-year-old at age 13 granted parole"
1634501265,news,Freed murderer charged in Florida with slaying of single mom
1634500648,news,"Alex Murdaugh coordinated with former housekeeper's family to sue himself for insurance money and then took $3 million, affidavits say"
1634499435,news,Removed Robert E. Lee statue now on display at Texas resort
1634498187,news,‘Third World’: Shelves empty amid shoplifting surge in New York
1634498055,news,"Walgreens closing 5 more San Francisco stores, blames rampant theft"
1634497911,news,17 Christian missionaries kidnapped in Haiti
1634496684,news,"At least one dead, several injured in on-campus shooting at Grambling State University"
1634496233,news,"La Palma volcano: Eruption on Canary Island shows no sign of slowing, officials say"
1634496122,news,"China condemns U.S., Canada for sending warships through Taiwan Strait"
1634495526,news,LA County wants Vanessa Bryant to take psych test in suit over leaked crash pics
1634494940,news,Looted van Gogh art to be auctioned in NY
1634494217,news,Israeli officer punished for violence against protesters
1634494171,news,Official Wizard of New Zealand fired by city council after more than 2 decades
1634493000,news,"China crackdown on Apple store hits holy book apps, Audible"
1634492292,news,"Bacon prices have skyrocketed to record levels, and they might not go down anytime soon"
1634491182,news,Woman conceived through rape wins award for campaign to convict father
1634491121,news,Police: 3 dead after knife attack on Arkansas officer
1634490882,news,These tiny homes in Los Angeles offer the city's homeless a new lease on life
1634488860,news,Miami private school to require students getting COVID vaccine to stay home for 30 days after each dose
1634488000,news,Woman suing Chicago Bears player after alleged assault at Charlotte hotel
