created_utc,subreddit,title
1634249839,news,New York real estate heir Robert Durst was sentenced Thursday to life in prison without chance of parole for the murder of his best friend more that two decades ago
1634249803,news,Michigan lawmakers advance measure to end 'tampon tax'
1634249684,news,Adult film star files defamation suit over competitors' dog sex video tweets
1634249385,news,Robert Durst Sentenced to Life in Prison for Susan Berman's Murder
1634249349,news,Robert Durst sentenced to life in prison for 2000 murder of friend Susan Berman
1634248749,news,Indian man gets double life sentence for killing wife using cobra
1634248671,news,Vaccine Proof Or Negative Test To Be Required For Large Events In Washington State
1634248454,news,Pakistan Airlines suspends Afghanistan flights amid Taliban row
1634247902,news,Americans quit their jobs at a record pace in August
1634245403,news,US to donate more than 17 million Johnson &amp; Johnson Covid-19 vaccines to African Union
1634244877,news,"A mom threw parties for teens and pressured them into sex acts, prosecutors say. She's charged with 39 crimes."
1634244430,news,Suspect Arrested in Murder of 7-Year-Old Girl Gunned Down in Chicago Earlier This Year
1634243919,news,Half-shredded Banksy fetches $25.4 mln on return to Sotheby's
1634243821,news,Another American Brand Exits China
1634242261,news,Knife sculpture in Tulsa neighborhood may be forcibly removed
1634242200,news,China warns against 'manipulation' of WHO virus probe
1634242091,news,"Two Alaska senators have tested positive for COVID, and a third is ill and undergoing testing"
1634242044,news,"Harvard Crimson: Harvard's Endowment Soars to $53.2 Billion, Reports 33.6% Returns"
1634241242,news,Missouri governor vows criminal prosecution of reporter who found flaw in state website • Missouri Independent
1634240367,news,Missouri's governor vows to prosecute a reporter who told the state about a data security risk
1634240051,news,'Human remains detection' K9 from Pasco County joins search for Brian Laundrie in Carlton Reserve
1634239689,news,Human chop shop that sold body parts for experiments without consent ordered to pay $58 million to donors’ families
1634239670,news,Southlake school leader tells teachers to balance Holocaust books with 'opposing' views
1634239655,news,Parson issues legal threat against Post-Dispatch after database flaws exposed
1634239630,news,FDA panel endorses lower-dose Moderna COVID shot for booster
1634239476,news,Governor calls special session over redistricting
1634239392,news,Missouri governor vows criminal prosecution of reporter who found flaw in state website (ie used 'inspect')
1634238140,news,State police investigate deadly shooting at Grambling State
1634237319,news,Ex-cop who killed Daunte Wright lays out possible defense
1634236952,news,"Harvard, world's wealthiest university, sees endowment soar to $53.2 bln"
1634236828,news,Cedar Rapids police: teen admitted to killing his parents to ‘take charge of his life’
1634236051,news,"Kenyan runner Agnes Tirop found dead, police hunt husband:Kenyan Olympic runner and two-time world championship bronze medalist Agnes Tirop has been found dead at her home with stab wounds"
1634235725,news,"LinkedIn to shut down China version, citing country's compliance demands | ZDNet"
1634233586,news,"Scientists abused and threatened for discussing Covid, global survey finds"
1634232973,news,Alex Murdaugh arrested on new charges after release from Florida drug rehab center
1634232829,news,B.C. woman awakes to a hole in her roof and a space rock on her pillow
1634232559,news,Amazon had keys to USPS mailbox used for union ballots: Report
1634232347,news,Nearly 40 percent of Mass. prison guards still haven't complied with the state's vaccine mandate
1634232311,news,No unemployment checks for health workers who refuse vaccine
1634232199,news,Microsoft shutting down LinkedIn in China
1634232185,news,"Kenya's Agnes Tirop: 'She was humble, focussed and smiling'"
1634231571,news,Police commissioner accused of victim blaming after Everard case resigns | Violence against women and girls - Said she should have 'resisted arrest' &amp; women should learn to be Street Wise
1634231536,news,Prince William slams space tourism and says billionaires should focus on saving Earth
1634231503,news,Postal worker's mother says he was bullied before shooting
1634231070,news,"Attacks on Hindu minority in Bangladesh amidst festival and prayers. People killed, temples vandalised"
1634230887,news,"Last living member of Cambodia's Khmer Rouge regime tries to overturn genocide, war crimes charges"
1634230519,news,"Google, YouTube won't allow ads or monetization of content denying climate change"
1634229463,news,Brett Favre owes $800K as Mississippi confronts its largest public embezzlement scandal
1634228600,news,Alabama man sentenced to death for killing wife and family
1634228328,news,US Border Patrol found two young sisters wandering alone near the Arizona border
1634228284,news,"South Carolina lawyer Alex Murdaugh arrested at drug rehab facility in Florida, charged with stealing insurance money in housekeeper's death"
1634227336,news,"Gary Paulsen, author of young adult novel 'Hatchet,' dies at age 82"
1634227318,news,Alaska doctors forced to ration life-sustaining treatments as Covid patients clog up hospitals
1634227049,news,Boeing finds new defect in ongoing struggle to produce Dreamliner 787
1634226358,news,Supreme Court appears likely to allow death sentence for Boston Marathon bomber
1634225914,news,Here is bow-and-arrow terrorist Espen Andersen Bråthen's warning
1634225833,news,Covid: New WHO group may be last chance to find virus origins
1634225751,news,Federal grand jury investigating Kansas City cop who allegedly 'exploited and terrorized' Black residents for decades
1634221822,news,Price pinch: global economy caught in perfect storm
1634221079,news,Microsoft to shut down LinkedIn in China
1634221077,news,'Toxic culture': NFL cheerleaders demand release of full workplace inquiry
1634220995,news,Fake doctor charged with issuing false Covid vaccine certificates
1634220580,news,The Climate Disaster is Here
1634220517,news,"Moped man sprays cop, cop retaliated with murder"
1634220110,news,TikTok dancers harassed at Downtown Crossing for wearing masks
1634219750,news,14th October 1964 - Martin Luther King Jr is announced as the winner of the Nobel Peace Prize
1634219031,news,"Woman charged with pretending to be doctor, issuing hundreds of fake vaccine exemptions 'doesn't believe she's done anything wrong'"
1634218711,news,A more comfortable goodbye? Vets bring pet euthanasia home
1634218650,news,"US Jobless claims fall below 300,000 for the first time since the pandemic began"
1634218465,news,Scientists name ancient eel-like creature after Black Sabbath guitarist Tony Iommi
1634218343,news,17 employees have died from Covid in a Florida school district since August
1634218050,news,Arcadia upholds giving sex therapist Susan Block’s internet studios the boot
1634217987,news,@Unusual_Whales Twitter is exposing US government officials in droves - Illegal &amp; Suspicious insider trading evidence.
1634217894,news,Australia is preparing for another showdown with Big Tech — this time over defamatory posts
1634217892,news,Norway officials: Bow-and-arrow attack appears act of terror
1634217791,news,Here are the best-selling electric cars in China so far this year
1634217567,news,"Capitol rioter represents himself, accidentally admits to more crimes"
1634215646,news,"California coronavirus death count tops 70,000 as cases fall - ""It’s the most in the nation, surpassing Texas by about 3,000 and Florida by 13,000"""
1634215077,news,At least 6 dead as heavy gunfire breaks out at Beirut protest
1634214864,news,Chicago police union head urges cops to defy vaccine mandate
1634214168,news,North Carolina Governor Roy Cooper calls for Lieutenant Governor to step down amid LGBT+ hate speech scandal
1634214084,news,Chicago police union head urges cops to defy Covid vaccine mandate
1634213171,news,Vietnam: Owners heartbroken after 12 dogs killed over Covid
1634212743,news,Covid-19 infections are declining in the US. But hospitalizations are still high in some hotspots
1634212725,news,Postal worker killed in Colorado in front of mailboxes; suspect at large
1634212588,news,Israel approves building plan in illegal Jerusalem settlement
1634212290,news,"Cincinnati police officer under investigation for allegedly shelving rape DNA test results, prosecutor says"
1634211869,news,"Unvaccinated Covid Patients Are Taking Up Hospital Beds. Now, Vaccinated Patients Are Getting Frustr"
1634210821,news,"Man arrested and charged in death of woman fatally shot by toddler while on Zoom work call, authorities say"
1634210569,news,"U.S. pastors, advocacy groups mobilize against COVID-19 vaccine mandates"
1634210272,news,Biden orders companies to ease supply chain bottlenecks or he’ll ‘call them out’ | Joe Biden
1634209528,news,Parents say Walgreens mistakenly injected them and their two kids with the Covid-19 vaccine instead of flu shot
1634208400,news,Deadly shooting rocks Beirut as tensions over blast probe erupt
1634206984,news,"More than 10,000 John Deere workers go on strike at 14 U.S. plants"
1634206405,news,Cheetah Release: Running for their lives: Speed cats return to Southern Mozambique after six decades
1634204515,news,Beirut port blast: Gunfire erupts at protest against judge leading probe
1634203866,news,"One killed, several wounded in gunfire near Beirut protest"
1634203693,news,Kongsberg: Bow and arrow suspect known to Norwegian police
1634203232,news,Kaohsiung: Fire at Taiwan tower block kills at least 46
1634198725,news,Demirören Şirketler Grubu'ndan mesnetsiz iddialar hakkında suç duyurusu
1634197604,news,Teen who did backflip in rhino enclosure in S'pore Zoo allegedly consumed cannabis while out on bail
1634197506,news,"Singapore: Man gets jail and caning for repeatedly raping 11-year-old daughter, wife caught him with contraceptive pills"
1634195655,news,"More Than 10,000 Deere &amp; Co. Workers Go on Strike After Rejecting Contract."
1634195008,news,Shop with yours chums | Yours Chummys
1634193551,news,US Olympic Committee defends handling of Nassar case
1634192736,news,"Japan dissolves parliament, setting stage for general election"
1634192704,news,China property shares slide as Evergrande crisis reverberates
1634190944,news,U.S. Supreme Court likely to restore Boston Marathon bomber's death sentence
1634190262,news,"US reaches record high of more than 96,000 drug overdose deaths in a 12-month period, CDC data show"
1634188826,news,Jersey played 'active' role in transatlantic slave trade
1634188806,news,XPO DRIVERS ACHIEVE NEARLY $30 MILLION IN SETTLEMENTS AFTER COMPANY MISCLASSIFIED ITS WORKERS
1634188715,news,Megaupload Lawsuits Remain in Limbo After Nearly 10 Years Passed
1634187731,news,The opening of off shore for wind power
1634187127,news,Trump: ‘Republicans will not be voting’ if 2020 fraud isn’t ‘solved’
1634185218,news,Singapore tightens monetary policy in surprise move as price pressures grow
1634184149,news,Two Birds Soar and Swim Back Into the Wild After Recovering From Oil Spill
1634183089,news,People in Israel and Bahrain are losing their vaccination status for not taking boosters
1634183043,news,US to rejoin UN Human Rights Council after walk-out under Trump
1634182819,news,Boston mayoral debate candidates meet up in first one-on-one debate
1634177398,news,Huawei rejected by 3 in 4 Canadians on eve of 5G decision
1634176086,news,Regeni murder: Egyptians go on trial for Italian student's murder
1634175366,news,"FluMist Nose Spray Vaccine Shouldn't Be Used, Experts Say, 2016."
1634173547,news,SARS-CoV-2 infection generates tissue-localized immunological memory in humans
1634171642,news,"U.S. home heating bills expected to surge this winter, EIA says"
1634171363,news,Thiết bị điện Xuân Phát
1634169562,news,France to ban plastic packaging for most fruit and vegetables from January 2022
1634169237,news,"An off-duty police officer shot her significant other, another off-duty officer, after she caught her with another woman"
1634168889,news,Jeff Bezos’ Blue Origin successfully launches crew with William Shatner to space and back
1634166562,news,"U.S. crude oil price tops $80 a barrel, the highest since 2014"
1634166371,news,"Rolling Stones pull 'Brown Sugar,' song with lyrics about slavery, from live performances"
1634165403,news,"Black construction worker shot 7 times in potential hate crime, police say | The victim's brother said the shooter said the n-word ""over and over again."""
1634164880,news,"California mom allegedly hosted wild, drunken sex parties for teens"
1634163739,news,Police: Five killed in bow-and-arrows attack in town near Norwegian capital of Oslo
1634163686,news,Biden tries to pin supply chain chaos on Trump as he scrambles to fix bottleneck
1634163380,news,Winter heating bills set to jump as inflation hits home
1634161814,news,"Verizon Has Been Blocking Various Websites, And Nobody Knows Why"
1634161735,news,State Police trooper who cried foul over brutality incidents is notified he'll be fired
1634161100,news,"UPDATE: Family to conduct private autopsy after coroner says 'no foul play, signs of trauma' in Christina Nance case"
1634160601,news,Pro-Iranian groups reject early Iraq election results as ‘scam’
1634160265,news,"Guatemala protesters disavow colonialism, Columbus, aiming at statues"
1634159809,news,Judge: ‘Texas 7' Death Row Inmate Should Get New Trial
1634159636,news,Middle-Class Migrants Fly to Mexico and Then Cross U.S. Border Illegally
1634159609,news,ViacomCBS gets into NFTs via a partnership with NFT startup Recur – TechCrunch
1634158090,news,8 Best Green Credit Cards to Support the Environment
1634157864,news,Woman sues after she is reportedly scalded by Dunkin' coffee
1634157752,news,Justices seem set to reinstate Boston Marathon bomber's death sentence
1634157556,news,Dylann Roof's request to reconsider recusal is denied
1634157354,news,Jan. 6 committee subpoena targets begin turning over docs
1634154386,news,The American Bumblebee Has Nearly Vanished From Eight States
1634154207,news,Several killed in attack in Norwegian town of Kongsberg
1634153857,news,Several killed in Norway bow and arrow attack
1634153824,news,Holocaust denial to become crime in Ireland under new hate law
1634153769,news,Guns aren't the problem
1634153715,news,Man goes on bow and arrow rampage in town with multiple killed and injured
1634153673,news,Cawthorn defies law on school property (again)
1634153627,news,"Norway: Several killed, injured in bow and arrow attack"
1634153588,news,"Fort Hood soldier found dead behind barracks, investigation underway"
1634153379,news,US to reopen Mexico And Canada land borders for fully vaccinated travellers
1634153344,news,Several people have been killed in Norway after a man used a bow and arrow to attack them.
1634153257,news,"Social Security checks going up by 5.9 percent, the highest increase in decades"
1634152797,news,Several killed in bow and arrow attack in Norway
1634152754,news,Fed officials: Bond purchases could end by middle of 2022
1634152695,news,US to reopen Mexico Canada land borders for fully vaccinated travellers
1634152180,news,'There have to be consequences:' Judge ups sentences for Capitol rioters
1634151709,news,"Norway: Several people killed and others injured in bow and arrow attacks, say police"
1634151511,news,"Killed on Zoom: Dad held after toddler finds gun, shoots mom"
1634151476,news,Several injured and killed on Kongsberg - shot with a bow and arrow (Norway)
1634151193,news,'Squid Game' Is Causing Kids To Beat Each Other Up
1634150083,news,"FDA recommends restaurants, food manufacturers cut back on use of salt"
1634149874,news,8% of drivers will swerve to deliberately kill animals.
1634149690,news,COVID No. 1 cause of death for 35-to-54-year-olds in September
1634148987,news,Chile opposition moves to impeach president over Pandora leaks
1634148916,news,U.S. inflation rate rises to 13-year high of 5.4%
1634147911,news,Sri Lanka drops charges against admiral over killings
1634147719,news,Jeffrey Epstein friend Ghislaine Maxwell teams up with feds in bid to keep proposed jury questionnaire secret in sex crime case
1634147713,news,Harvard programme moves from Beijing to Taipei
1634147478,news,New Caledonia's Prony to supply nickel to Tesla in multi-year deal
1634146880,news,Boeing tells workers they must get COVID-19 vaccine
1634146820,news,"Markets scale fresh highs, Nifty closes above 18,000"
1634145894,news,Blue Origin sends William Shatner to edge of space
1634145597,news,Supreme Court hears death penalty arguments for Boston Marathon bomber Dzhokhar Tsarnaev
1634145281,news,China's Xi launches $232 mln biodiversity protection fund for developing countries
1634144668,news,Borrowers denied student loan relief will get a second look
1634142930,news,Is that the way death is? 11-minute space odyssey overwhelms William Shatner
1634142158,news,Wisconsin parents file lawsuits against school districts over their children's Covid-19 infections
1634141935,news,WHO says global Covid deaths fell to lowest level in a year last week
1634141542,news,Two people died after a single-engine plane crashed into a residential area in the Village of Waukesha
1634141216,news,William Shatner sets record in space with Blue Origin spaceflight
1634140685,news,Hollywood crews say they will strike next week if there is no agreement
1634140603,news,US becomes world's cryptocurrency epicenter after China ban
1634140256,news,"Shatner, Trek’s Kirk, reaches final frontier on Blue Origin ship"
1634139735,news,Florida fines key county $3.5 million for mandating vaccines
1634139578,news,U.S. calls Cambodia opaque over Chinese activity at navy base
1634139040,news,"Boeing will require its 125,000 U.S. employees to be vaccinated against COVID-19"
1634138291,news,"Film TV Workers Union (60,000 Members) Says Strike is Set to Start October 18th"
1634137329,news,"Blue Origin successfully sends ""Capt. Kirk"" to space"
1634137312,news,Star Trek actor William Shatner becomes oldest person to reach space aged 90
1634137188,news,Louisiana zoo animals are getting vaccinated against COVID-19
1634136756,news,"William Shatner, TV's Capt. Kirk, boards rocket for blastoff"
1634135338,news,Social Security COLA largest in decades as inflation jumps
1634135257,news,New Toxic Drug Impurities Detected in Some Heart Pills in U.S.
1634135150,news,White House to host global anti-ransomware meeting without Russia
1634135110,news,"70,000 pounds of grapes, diesel spills on highway near Gilroy"
1634134739,news,Hamas is increasing its activity in Lebanon and angering Hezbollah
1634133765,news,Social Security cost-of-living adjustment will be 5.9% in 2022
1634133441,news,Social Security cost-of-living adjustment could be at least 6% in 2022 - could be the highest it has been since 1982
1634132935,news,Exclusive: Family talks to 14 News about claims of vaccine mistake at Walgreens
1634132093,news,U.S. becomes largest bitcoin mining center following China ban
1634131991,news,"White House says Walmart, FedEx, UPS will move to 24/7 model to address supply chain bottlenecks"
1634131478,news,Jamie Costa's Robin Williams impersonation leaves fans clamoring for more
1634130272,news,CNBC: Consumer prices rise more than expected as energy costs surge
1634130196,news,"Rebuffing Texas governor, American Airlines, Southwest stand by vaccine mandate"
1634130121,news,"Report: For 20 Top-Selling Drugs, Big Pharma Made Far More From U.S. Sales Than From the Rest of the World Combined"
1634130088,news,Oxford unit kills off Indian democracy book - Authors lash out at Oxford University Press India's refusal to publish volume critical of PM Modi's anti-democratic ways
1634128965,news,Bay Area woman charged with hosting secret teen parties filled with booze and sex ｜ The Mercury News
1634128413,news,Loudoun County father arrested at school meeting says daughter was raped by boy ...
1634128148,news,"Port of Los Angeles going 24/7 to help relieve U.S. supply chain backup, White House says"
1634128128,news,Apple may cut iPhone 13 production by millions as US warns of Christmas shortages
1634128081,news,Watch Live: William Shatner blasts off to space aboard Blue Origin rocket
1634127631,news,Parents say Black students were beaten and spit on by white classmates
1634127493,news,New FDA guidance aims to drastically cut salt in food supply
1634127460,news,Our underwater future: What sea level rise will look like around the globe
1634126817,news,"Marine who criticized military over Afghan withdrawal to plead guilty at court martial, lawyer says"
1634126098,news,Tensions rise as US seeks answers from Tesla over no recall
1634125883,news,Turkey’s Rumeysa Gelgi confirmed as tallest woman living
1634125489,news,Judge Judy Bailiff ‘Confused And Dismayed’ Over Not Being Invited To Her New Show
1634125280,news,Social media surveillance can watch your every move
1634124992,news,"US to open border with Canada, Mexico starting in early November"
1634124742,news,Brexit: EU to offer fewer Northern Ireland border checks on British goods
1634124425,news,"Amazon copied products and rigged search results to promote its own brands, documents show"
1634123665,news,3 employees killed in shooting at postal facility in Memphis
1634122977,news,"""Rarest Of Rare Case"": Kerala Man Guilty Of Wife's Murder With Cobra Bite"
1634122668,news,U.S. to open land borders to fully vaccinated people
1634120736,news,"Antisemitism 'rife' on social media platforms like Instagram and TikTok, research finds"
1634119205,news,Wolf pups 'adopted' by Idaho high schoolers killed by federal agents
1634118885,news,Mexico City to swap Columbus statue for one of indigenous woman
1634116339,news,Norway to hit 100 per cent electric vehicle sales early next year
1634113573,news,cursos online
1634110281,news,"Cleric Sadr wins Iraq vote, former PM Maliki close behind, officials say"
1634109939,news,Far-right extremists in Ukraine brag of training by Canadians: report
1634106296,news,Havana syndrome reported at US embassy in Colombia
1634105991,news,US to reopen land borders with Canada and Mexico in November | US news
1634104605,news,"3 USPS workers, including suspect, dead after shooting at Memphis facility"
1634104558,news,Retired Marine colonel says US should weigh nuclear war with China over Taiwan
1634104254,news,William Shatner to blast off on Bezos rocket to become oldest person in space
1634099587,news,Florida fines county over $ 3.5 million for COVID vaccination warrant
1634099004,news,Florida fines county $3.5 million for mandating vaccines
1634098923,news,Ricarlo Flanagan Dies: ‘Shameless’ Actor’ &amp; ‘Last Comic Standing’ Semifinalist Was 40
1634098664,news,AP: China exports up 28% in September; surplus with US at $42B
1634097785,news,Federal judge allows health care workers in New York to apply for religious exemptions to Covid-19 vaccine mandate
1634096149,news,US to reopen land borders in November for fully vaccinated
1634093633,news,Florida man charged after toddler fatally shot mom during Zoom call
1634093016,news,U.S. to open border with Canada starting in early November
1634091104,news,U.S. to reopen land border to Canadians next month
1634090719,news,"Bounty hunter fatally shoots fugitive in Texas, sheriff says"
1634089507,news,Food prices reach highest level in a decade.
1634088811,news,German shock at neo-Nazi burial in empty Jewish grave
1634085452,news,Fort Hood soldier found dead behind company barracks
1634085412,news,House Decorated in Homage to Brutal Triple Murder
1634084247,news,"What sea level rise will do to famous American sites, visualized"
1634084125,news,Major hospital systems in Ohio requiring Covid vaccinations for organ transplants
1634083444,news,Medical Aid Groups Welcome Plans by Moderna to Build Plant in Africa
1634082890,news,Texas man charged with threatening prominent doctor over her Covid vaccine advocacy
1634080063,news,Two teenagers charged for allegedly killing 14 kangaroos in Australia
1634079821,news,"Jackson State student beats COVID-19, but still needs kidney transplant"
1634079455,news,'Please Get Your Child Vaccinated': Children's Minnesota's Chief Doctor Pleads With Parents As COVID Cases Rise
1634079148,news,"US FDA OKs Vuse e-cigarettes, its first vape authorization"
1634078670,news,Hasbro CEO Brian Goldner has died
1634078488,news,Tyga surrenders to police after allegation of domestic assault against the rapper
1634078444,news,Texas agency removes webpages with resources for LGBTQ youths
1634078154,news,3 employees dead following shooting at Memphis post office
1634078101,news,Indianapolis police sergeant charged after body camera video showed him kicking a handcuffed man in the head
1634078039,news,Chile declares state of emergency over Mapuche conflict
1634077963,news,A daily aspirin to protect the heart? That soon may be outdated advice
1634077744,news,Walgreens closing 5 SF stores due to 'organized retail crime'
1634077601,news,"FDA authorises vaping brands, saying it helps smokers."
1634077281,news,Many breast cancer patients are using marijuana and not telling their doctors
1634076631,news,"Coinbase user calls out customer support after losing $700,000 in hack: CNBC After Hours"
1634076194,news,دانلود آهنگ جدیدچش قلبی از کاما
1634075801,news,Smash Mouth Singer Steve Harwell Retires After Disoriented New York Concert
1634075742,news,Body camera footage shows police officers dragging paralyzed man from a car by his hair
1634075191,news,U.S. considering options for responding to crisis in northern Ethiopia -State Dept
