created_utc,subreddit,title
1634074975,news,High-affinity memory B cells induced by SARS-CoV-2 infection produce more plasmablasts and atypical memory B cells than those primed by mRNA vaccines
1634074843,news,"SOURCES: 3 people shot, at least 1 dead at Orange Mound post office"
1634074154,news,Apple likely to slash iPhone 13 production due to chip crunch
1634073598,news,"FDA authorizes first e-cigarettes, cites benefit for smokers"
1634072941,news,"Calif. mom who received $4.9M after police killed her son arrested for buying guns for other son, gang"
1634072088,news,"New York must allow religious exemptions to COVID-19 vaccine mandate, judge rules"
1634071754,news,"Hasbro CEO Brian Goldner dies, days after stepping down for health reasons"
1634071489,news,Mom accused of throwing drunken parties where teens were sexually assaulted
1634070588,news,"'There will be things that people can't get,' at Christmas, White House warns"
1634070566,news,Gabby Petito's autopsy report: Live updates
1634069939,news,Lgbtq Debate Will Be Made Public
1634069688,news,Covid and Age: An unvaccinated child is at less risk of serious Covid illness than a vaccinated 70-year-old.
1634069327,news,Spokane drops requirement for paramedics to ride with patients in AMR ambulances
1634069314,news,Police investigating shooting at post office in Memphis
1634069127,news,Federal immigration agents to end practice of worksite raids
1634067212,news,Gabby Petito died by strangulation: Medical examiner
1634066927,news,US workers are quitting their jobs in record numbers
1634066530,news,"Gabby Petito's cause of death was strangulation, coroner says"
1634065916,news,Czech voters oust communists from parliament for the first time since 1948
1634065029,news,Some Alaska legislators urge easier ivermectin access
1634064905,news,18 weather and climate disasters this year have killed over 500 people and cost over $100 billion in US
1634064898,news,Gabby Petito cause of death was strangulation.
1634064669,news,"Gabby Petito died by strangulation, coroner says"
1634064603,news,"Gabby Petito's cause of death was strangulation, coroner determines"
1634064115,news,"Coroner: Gabby Petito died by strangulation, death ruled a homicide"
1634063916,news,Can Depay carry out his form to Barcelona? ⚽
1634063639,news,"Nearly 150 group home workers go on strike, others settle"
1634063437,news,"Paddy Moloney, leader of Irish band the Chieftains, dies aged 83"
1634062445,news,Homeland Security secretary orders ICE to stop mass raids on immigrants' workplaces
1634061843,news,"Jay-Z who recently has a song where he uses the word ""crackers"" in a racially derogatory manner, has a partnership with the NFL to produce the Super Bowl halftime show among other league related events."
1634061231,news,Serious financial problems afflict 40% of US households in recent months | US news
1634060207,news,"As Shatner heads toward the stars, visions of space collide"
1634060190,news,"She buried her 10-year-old who died from Covid. Less than 24 hours later, she was combating misinformation at a school board meeting"
1634059828,news,Catholic priests in France ‘must report abuse allegations heard in confession’ | Minister reprimands top bishop for claiming the secrecy of confessional ‘above laws of the Republic’
1634058587,news,IMF slashes US growth forecast and warns of rising risks to the global economy
1634057724,news,James Webb super-telescope arrives at launch site
1634057679,news,Judge rejects state's residency rule for medical marijuana
1634057367,news,Netflix backs comedian Dave Chappelle despite criticism over trans remarks | CBC News
1634057325,news,"Bolsonaro must be held criminally responsible for assault on the Amazon, say activists"
1634056992,news,"A record 4.3 million US workers quit their jobs in August, led by food and retail industries"
1634056451,news,"Small plane crashes into California neighborhood, killing 2"
1634056142,news,Eddie Jaku: Holocaust survivor and peace campaigner dies aged 101
1634056055,news,"Terror &amp; tourism: Xinjiang eases its grip, but fear remains"
1634055250,news,"Alisal Fire forces evacuations, shuts down portion of Highway 101 in Southern California"
1634054961,news,"DHS to end workplace raids, shift focus to employers over undocumented workers"
1634054643,news,Parents speak after accusing Walgreens of administering COVID-19 vaccines instead of flu shots
1634054249,news,"Sophia, the first android with citizenship, now wants to have a robot baby"
1634054102,news,Several asteroids bigger than Great Pyramid of Giza will approach Earth in coming weeks
1634053881,news,"Nets say Kyrie won't play, practice until eligible"
1634053360,news,Slain reporter's father takes on Facebook over violent video
1634053311,news,"Nobel prize will have no gender or ethnicity quotas, academy head says"
1634052641,news,Kyrie Irving 'will not play or practice' with the Brooklyn Nets until he is vaccinated against Covid-19
1634051488,news,"Most adults shouldn't take daily aspirin to prevent heart attack, panel says"
1634050914,news,"Loudoun County Schools Tried To Conceal Sexual Assault Against Daughter In Bathroom, Father Says"
1634050768,news,Moderna has no plans to share its COVID-19 vaccine recipe
1634050582,news,Brazil's Bolsonaro accused of crimes against humanity at ICC for his record on the Amazon
1634049104,news,Child actors used for Kamala Harris’ bizarre space video
1634048328,news,Elk wandering Colorado for two years with tyre around neck is freed
1634048162,news,"Humans used tobacco 12,300 years ago, new discovery suggests"
1634045603,news,"Volcano cloud passes, lockdown ends for 3,000 residents of Spanish island"
1634044835,news,"After several attempts, wildlife officers remove tire that was around an elk's neck for over two years"
1634044774,news,"CNBC: IMF cuts its global growth forecast, citing supply disruptions and the pandemic"
1634044449,news,The new Superman comes out as bisexual in an upcoming comic
1634044203,news,California to enforce 'gender neutral' toy aisles in large stores
1634043985,news,Activists seek legal marijuana in former hippie haven Nepal
1634042979,news,Michigan tells majority-Black city not to drink tap water amid lead crisis
1634042444,news,San Jose police arrest 3 suspects in 20-year-old homicide cold case
1634041401,news,"India: Adani Ports to shun cargo from Afghanistan, Pakistan, Iran | Drugs News"
1634041357,news,Dozens of companies in Florida accused of breaking law against requiring vaccine proof
1634041296,news,Man fails in appeal against death sentence for transporting 1kg of cannabis into Singapore
1634041053,news,"Black paraplegic dragged from car calls Dayton, Ohio, police 'inhumane'"
1634040479,news,Harvard Beijing Academy’s Move to Taipei
1634040226,news,Watch: Bodycam shows Ohio police pull disabled Black man from car
1634040159,news,Georgia's Fulton County fires election workers accused of shredding voter applications
1634039850,news,"Parent sues Wisconsin school district after son gets COVID-19, allegedly from classmate"
1634039158,news,More than one incendiary device found at the burned home of Dallas County kidnapping suspect
1634038599,news,Parent sues Wisconsin school district after child contracts Covid
1634037891,news,Pro-Iran groups seen losing Iraq election and firebrand cleric winning
1634037130,news,"Trafficking victims should be granted leave to remain in UK, high court rules"
1634036802,news,IMF reaffirms 'full confidence' in head Georgieva after data-rigging claims
1634036781,news,"EU seeking to ensure gas supply to Ukraine, Commission says."
1634036727,news,Strange radio waves from the heart of the Milky Way stump scientists
1634036535,news,"Lockdown ends for 3,000 La Palma residents as volcano cloud passes"
1634036429,news,"Eric Clapton Donates More Than $1,300 To Anti-Vax Band Through Crowd Funding Site"
1634035580,news,Ryanair bans Covid refund passengers from boarding new flights
1634033006,news,Muqtada al-Sadr’s party poised to win Iraqi election
1634032551,news,Samsung leader Lee pleads guilty to unlawful use of sedative
1634030133,news,Biden is going big on testing. It still may not be enough.
1634030015,news,"I want US, UK to know that we'll not surrender to LGBTQI nonsense even if we're choked in Parliament — Ibrahim Murtala"
1634025795,news,"Halt destruction of nature or risk ‘dead planet’, leading businesses warn"
1634025718,news,Nobel economics prize rewards work on minimum wage
1634023227,news,best indian nsfw stufff check comment box
1634022691,news,FBI raids home of Philadelphia Proud Boys’ vice president to gather info about Capitol attack plans
1634020609,news,A journey through space weather | ITV News
1634020327,news,Brazil’s Bolsonaro says he is ‘bored’ with COVID deaths questions
1634018195,news,China says it held beach landing drills in province opposite Taiwan
1634017352,news,Schools are new battleground in war of disinformation over Covid-19 vaccines
1634017223,news,UK lawmakers slam government's early Covid response
1634015807,news,A Wisconsin parent files a lawsuit against school district over son's Covid-19 infection
1634014836,news,"California law to eventually ban gas-powered lawn, yard equipment"
1634014614,news,"School district to keep mask mandate, defy Abbott's order after staff deaths from COVID"
1634014282,news,Teenager's death marks another COVID loss for Central Texas school district
1634012476,news,"Florida is short more than 5,000 teachers, education group says"
1634011566,news,Raiders coach Gruden resigns in wake of emails
1634010729,news,Jones Snowboards Collaborates With World Renowned Surfboard Shaper For New Collection
1634009551,news,Grocery store shelves aren't going back to normal this year
1634006688,news,Fan Uses Prosthetic Leg To Catch Baseball At White Sox Game
1634004804,news,"NYC Son, 18, Shoots Mom to Death After Fight at Dinner Table: Police"
1634003125,news,AP source: Gruden out as Raiders coach over offensive emails
1634002367,news,Family with kids ages 4 and 5 went to Walgreens for their flu shot later finds out that they accidentally gave them the Covid vaccine instead.
1634002345,news,Report: Gruden Resigns After Release of Anti-LGBTQ Emails
1634002221,news,DC Comics reveal that latest Superman character is bisexual
1634002075,news,"“Miami Mafia” Strikes Again - City Manager Suspends Miami Police Chief Art Acevedo, Moves to Fire Him"
1634001483,news,"Texas governor bans all COVID-19 vaccine mandates, including by private businesses"
1634000239,news,Netflix standing by Dave Chappelle and 'The Closer'
1633999576,news,New details emerge after juvenile charged for shooting at teens he said bullied him
1633999046,news,Ethiopia civil war: Thousands of troops assemble on highway to front line in bloody conflict
1633998493,news,"Former HPD Chief Art Acevedo suspended as Miami Police Chief, expected to be terminated"
1633998285,news,Energy Crisis of the 1970's
1633997027,news,Ex-Gardena Officer Found Guilty for Second Time of Firearms Sales
1633996859,news,Miami Police Chief Art Acevedo Is Out
1633996212,news,Thailand to reopen for some vaccinated visitors on 1 November
1633995488,news,Blue Origin readies for space launch with William Shatner aboard
1633994352,news,California makes it illegal to remove condom without consent
1633993519,news,Elon Musk trolls Jeff Bezos as he widens his lead as the richest person on Earth
1633993311,news,"Naval nuclear engineer, wife arrested on espionage charges taught in Denver"
1633992906,news,At least 2 dead after plane crashes into residential neighborhood near San Diego
1633991805,news,Italy's toughest-in-the-world COVID-19 vaccine mandate sparks violent protests
1633991798,news,Former tobacco field where MLK Jr worked to be preserved
1633991099,news,"Iran-linked hackers targeted maritime and defense contractors, compromised Office 365 accounts"
1633990784,news,1st executive to head to prison in doomed nuclear project
1633990716,news,UNC Chapel Hill cancels classes Tuesday amid two suicide investigations
1633989139,news,'Judge Judy' bailiff says he wasn't invited to be a part of her new show
1633987380,news,Police dragged a paraplegic man from his car after he told them he couldn't get out
1633987361,news,Lawsuit filed in Florida over a mural showing city's first Black female firefighter depicted with a White face
1633986654,news,Former North Korean senior colonel-turned-defector gives first public interview
1633985861,news,Election workers accused of shredding voter applications
1633985768,news,Shipping disruption: 'We're doing our best - but this is crippling'
1633985747,news,"Agent’s shooting death has local real estate community in mourning, on alert"
1633985451,news,"Jon Kent, the new Superman, comes out as bisexual in new comic"
1633985328,news,Deputies: 32 migrants found in boat after traffic stop
1633984902,news,"The everything shortage: Shelves bare, delays in deliveries and pharmacies without medicatoin - California News Times"
1633984786,news,Rotting Red Sea oil tanker could leave 8m people without water.
1633983368,news,Police: A&amp;M-Bama argument led to fatal shooting
1633983003,news,"Southwest cancels hundreds more flights, denies sickout"
1633982885,news,"Black Children Jailed For No Reason, Adults Responsible Face No Charges..."
1633982882,news,Argument Over Alabama-Texas A&amp;M Game Led to Fatal Shooting
1633982660,news,"Emergency Crews Responding To Plane Crash In Santee, California"
1633982558,news,دانلود آهنگ این نظم بی نهایت از عشق هست یا نیست
1633982501,news,Gas prices skyrocket as the global energy crisis worsens
1633982433,news,"‘Send us home,’ beg Afghan refugees stuck in UK hotels | Refugees"
1633981009,news,Making Money from Misery: How social media giants profit from animal abuse - SMACC report
1633980856,news,"As Brazil passes 600,000 COVID-19 deaths, vaccines offer hope worst is over"
1633979170,news,I will fight anti-gay bill with my last blood – Board Member of LGBTQ+ Right Ghana
1633978598,news,Woman arrested for voting in US election while on federal supervised release
1633978589,news,MTSU student organization takes to social media to expose student who allegedly damaged their property
1633977737,news,Minnesota clinic shooting brings premeditated murder charge
1633976502,news,"In A Rocky Israeli Crater, Scientists Simulate Life On Mars"
1633975937,news,NC Lt. Gov. Mark Robinson under attack over anti-LGBT views
1633975349,news,"'Speaking up is not what they want': Students, graduates speak out about racist patterns at FHS"
1633975143,news,"Anchorage’s first ever chief equity officer fired, replaced by Bronson administration"
1633973738,news,Suspected Colorado supermarket shooter found not competent to stand trial
1633973301,news,Taiwanese president: China offers no free or Democratic way of life
1633972992,news,Fauci says it's okay to trick or treat on Halloween
1633972847,news,Georgia men charged in killings of Alabama women
1633972036,news,"Over 500,000 pounds of canned beef recalled over high lead levels"
1633971003,news,"Military leaders saw pandemic as unique opportunity to test psyops techniques on Canadians, Forces report says"
1633970539,news,"At south Mississippi church, members can give cryptocurrency"
1633970343,news,Navy engineer accused of passing restricted information in peanut butter sandwich
1633969243,news,US couple accused of selling nuclear submarine secrets to a foreign government.
1633967342,news,Accountant cleared of drink driving after claiming she guzzled vodka AFTER crash
1633966698,news,"Georgia police officer, 26, shot to death in first shift on job"
1633966600,news,Ohio police probed after man screaming 'I'm paraplegic' dragged from car
1633965564,news,Hennie Slotemaker: Lifetime of vaccinations made difference - Everett Daily Herald
1633964471,news,Capitol Police whistleblower blasts two senior leaders for 'failures' on Jan. 6
1633963077,news,"Russia's Navalny says prison has changed his status to ""terrorist"""
1633962313,news,British police are taking no further action against Prince Andrew and the late Jeffrey Epstein.
1633960825,news,Fort Hood: Missing soldier found safe
1633960733,news,L.A. driver accused of trying to hit pedestrians found beaten to death
1633959453,news,UK police won't act against Prince Andrew over abuse claim
1633958689,news,Russia Marks Record 12-Month Population Decline - The Moscow Times
1633958370,news,"Gun violence claiming more lives of American teens, children"
1633958032,news,"Multiple tornadoes reported in Oklahoma, leaving thousands without power"
1633957726,news,Driver who tried to hit people with vehicle is attacked by citizens and dies
1633957368,news,"India, China trade blame for break down in border talks"
1633957367,news,Parent sues school district after child contracts COVID-19
1633956940,news,"Real-life Squid Game is being organized in Abu Dhabi, of course without the violence"
1633956806,news,Human remains found by deputies looking for Lauren Cho in California
1633954775,news,U.K. police say won't take action on Prince Andrew sexual assault suit
1633952469,news,"Bodycam video shows Dayton, Ohio, police officers dragging a Black paraplegic man out of his car during a traffic stop"
1633950283,news,Covid Australia: Sydney celebrates end of 107 day lockdown
1633950038,news,Lego to remove gender bias from its toys after findings of child survey
1633949553,news,A man died after getting attacked by bystanders when he drove his car onto a sidewalk in attempts to strike pedestrians
1633947243,news,Kraft Heinz says people must get used to higher food prices
1633947001,news,Nobel panel to announce 2021 economics prize
1633946886,news,Merck asks US FDA to authorize promising anti-COVID pill
1633946863,news,"Nobel Prize in economics awarded to David Card, Joshua Angrist and Guido Imbens"
1633944988,news,No charges against Prince Andrew over Epstein incidents
1633944864,news,North Korea defector finally talks
1633944462,news,"U.S. will send humanitarian aid to Afghanistan, Taliban says"
1633941827,news,Pope Francis launches consultation on Church reform
1633941634,news,"Man shot and killed after confronting gunman for fondling his teenager daughter, SCSO says"
1633931917,news,"United States has lost AI battle to China, Pentagon's ex-software chief says"
1633928363,news,"25% of all critical infrastructure in the US is at risk of failure due to flooding, new report finds"
1633926276,news,"Two killed, including police officer, in Louisiana shooting"
1633924403,news,Czech president in hospital after shock election defeat for PM
1633924123,news,"California Bans Gas Powered Lawn Mowers, Chain Saws, and Leaf Blowers Starting in 2024"
1633923170,news,US couple arrested for selling nuclear warship information
1633920492,news,Indiana family says kids were wrongly given COVID-19 vaccine instead of flu shot
1633919755,news,Man who helped ignite George Floyd riots identified as white supremacist: Police
1633916300,news,"North Carolina lieutenant governor says he ""will not back down"" amid calls to resign for calling LGBTQ+ education ""filth"""
1633911789,news,Fauci says it’s fine to trick-or-treat this year
1633910730,news,QAnon beliefs fuel child-kidnap plot in France
1633908744,news,US navy engineer arrested for selling nuclear submarine secrets
1633908500,news,DHS Sec. Mayorkas calls for legislation to grant separated families legal status
1633906259,news,"US has already lost to China in AI fight, says ex-Pentagon software chief"
1633905919,news,6.2 magnitude earthquake strikes south of Big Isle; no tsunami threat
1633904670,news,"3 Men Arrested After 'Hellish' Shootout At St. Paul Bar Leaves 1 Dead, 14 Injured"
1633904517,news,US Navy nuclear engineer charged with trying to pass submarine secrets to foreign power
1633904300,news,"Earthquake of magnitude 6.1 strikes Naalehu, Hawaii – USGS"
1633903908,news,Taiwan 'will not bow' to pressure from China
1633903049,news,"US has agreed to give Afghanistan humanitarian aid, claims Taliban"
1633902890,news,US navy engineer charged with trying to sell nuclear submarine secrets
1633902677,news,Kyrie Irving update: Steve Nash says Nets 'recognize he's not playing home games' this season
1633902624,news,La Palma's volcanic eruption is going strong 3 weeks later
1633902541,news,Georgia police arrest man accused of fatally shooting officer who was working his first shift
1633900412,news,Chris Packham vows to continue activism after arson attack on home
1633900267,news,"China-Taiwan tensions: We will not bow to Beijing pressure, says leader"
1633899195,news,Bolshoi Theatre performer killed in accident on stage during opera
1633899028,news,Facebook plans to reduce the presence of politics on people's feeds | Science &amp; Tech News
1633897436,news,"Southwest Airlines cancels more than 1,000 flights Sunday"
1633896958,news,"Man who tried to hit people with his vehicle is attacked by citizens, dies"
1633895745,news,Us Navy nuclear engineer tried selling nuclear submarine secrets to a foreign state who was an undercover FBI agent
1633895417,news,"$2 million worth of marijuana was found in a Florida storage facility, and the sheriff's office wrote a Facebook post looking for the rightful owner"
1633895089,news,State electricity returns in Lebanon but still maxes out at two hours in most areas
1633894969,news,Long-banned FaceTime calls apparently working in UAE
1633894911,news,A mass extinction event occurred 30M years ago and scientists have only just learned about it
1633894874,news,Facebook unveils new controls for kids using its platforms
1633894793,news,15 dead after Russian skydiver plane crashes
1633894731,news,"A suspect accused of ambushing and killing a state trooper and shooting 4 other people has been arrested, authorities say"
1633894679,news,Controversial father of Pakistan nuclear bomb dies at age 85 of COVID-19
1633894641,news,Taliban says U.S. will provide humanitarian aid to Afghanistan
1633894465,news,Thousands march in Brussels to demand tougher climate action
1633894425,news,California law to eventually ban gas-powered lawn equipment
1633894340,news,Antarctica's last 6 months were the coldest on record
1633894275,news,Taiwan rejects China's 'path' amid show of military force
1633894213,news,Doctors warn of possible rise of debilitating nervous-system disorder in patients with long COVID-19
1633893353,news,Canada's overworked healthcare sector brace for staff shortages as vaccine mandates loom
1633893242,news,Aventura Vet Who Pled Guilty to Sexually Abusing Dog Sentenced to 272 Months
1633892540,news,Thousands march in Brussels to demand climate justice
1633892499,news,"One Starbucks At A Time, Workers Fight For Better Pay &amp; Conditions"
1633891673,news,"U.S. Navy engineer, wife charged with selling submarine secrets"
1633890658,news,Taliban concludes ‘positive’ talks with US officials in Doha
1633890112,news,Police officer who shot and killed Jacob Blake won’t be charged: U.S. federal prosecutors
1633889665,news,AT&amp;T is top corporate donor to Texas abortion law sponsors
1633887721,news,Pandora Papers: How the rich and elite use U.S. states to hide billions
1633887594,news,"Facebook plans to reduce the presence of politics on people's feeds, Nick Clegg says"
1633887543,news,"India farmers' protests: Son of India government minister arrested, accused of killing four farmers"
1633887524,news,US Navy engineer tried to leak nuclear submarine secrets: FBI
1633885963,news,Escaped suspect accused of injuring Arizona sheriff's deputy is in custody
1633884655,news,"Taiwan will not bow down to China, says president"
1633884046,news,China says Taiwan president’s speech ‘incites confrontation’
1633883211,news,Unicorn Security
1633883153,news,The true story of how Army paratroopers traded dip for a Toyota gun truck used to secure the Kabul airport
1633881924,news,"Southwest Airlines cancels 1,000 more flights as disruptions mount"
1633881515,news,"Shootout in busy Minnesota bar leaves 1 dead, 14 injured"
1633880861,news,Woman sentenced to 4 days in jail in Yellowstone grizzly bear incident.
1633879988,news,California man dies after being beaten by people he tried to hit with truck | California
1633879870,news,Britain and Ireland argue on Twitter over Brexit deal
1633879800,news,EXPLAINER: How US states help rich foreigners shield assets
1633879039,news,"4 policemen killed in northern Mexico, 1 wounded"
1633878530,news,"Russian plane carrying parachutists crashes, 16 killed"
1633877929,news,Photos from NASA's Perseverance rover indicate ancient flash floods on Mars
1633877640,news,"A passenger is in custody after exhibiting 'suspicious and erratic behavior' aboard American Eagle flight, air carrier says"
1633876575,news,Pope opens two-year consultation on Catholic Church future
1633874597,news,Doctors claim Brazil hospitals gave dodgy COVID-19 care
1633873654,news,"Getting flu with Covid doubles risk of death, says UK health chief"
1633873053,news,U.S. and Taliban hold first talks since Afghanistan withdrawal
1633872928,news,Largest Hispanic civil rights advocacy organization severs ties to Facebook
1633870660,news,"Sinking Millennium Tower work was halted 'months' too late, expert says"
1633870193,news,Controversial father of Pakistan nuclear bomb dies at age 85
1633869168,news,"One dead, at least 14 others injured in St. Paul shooting"
1633867189,news,UK police reportedly speak to Prince Andrew accuser Virginia Giuffre
1633865971,news,Tennessee doctors who spread COVID-19 vaccine misinformation could lose their licenses
1633864526,news,Woman charged after allegedly starving her boyfriend's 7-year-old son to death
1633862941,news,Mars scientists now know where to look for life
1633855077,news,"Smaller packs, same price: curse of ‘shrinkflation’ hits shoppers’ baskets"
1633851943,news,"Taiwan wants 'status quo', not China's path, president says"
